{
  "schema_version": 1,
  "generated_at": "2026-10-26T11:18:21.784Z",
  "application": "CampusVault",
  "environment": {
    "node_version": "v24.21.0",
    "platform": "win32",
    "arch": "x64",
    "os_release": "10.0.26300",
    "cpu_model": "AMD Ryzen 3 3250U with Radeon Graphics         ",
    "cpu_count": 4,
    "total_memory_bytes": 6376402944,
    "timezone": "Asia/Jakarta"
  },
  "methodology": {
    "warmup_iterations": 1,
    "measured_iterations": 10,
    "algorithms": [
      "AES",
      "DES",
      "RC4"
    ],
    "fixture_count": 4,
    "combinations": 12,
    "timer": "node:perf_hooks performance.now()",
    "includes_kdf": true,
    "kdf": "HKDF-SHA256 with a fresh random per-envelope salt",
    "includes_encryption_and_mac": true,
    "includes_mac_verification_and_decryption": true,
    "includes_sha256_correctness_check": true,
    "excluded": [
      "HTTP/network",
      "database",
      "filesystem writes",
      "browser rendering"
    ],
    "algorithm_order": "rotasi deterministik per fixture dan ronde",
    "statistics": "mean, median, min, max, sample standard deviation (n-1)"
  },
  "fixtures": [
    {
      "id": "personal-data",
      "name": "Data Personal Dummy (CSV)",
      "file": "personal-data.csv",
      "mime_type": "text/csv",
      "category": "personal",
      "description": "Dataset anggota dummy untuk skenario data personal.",
      "bytes": 8704,
      "sha256": "a94101af8827e742bdbbd4aea9fbea7a4548485523b55eb35c3ae74c89a46725"
    },
    {
      "id": "identity-scan",
      "name": "Pemindaian Identitas Dummy (PNG)",
      "file": "identity-scan.png",
      "mime_type": "image/png",
      "category": "identity",
      "description": "Gambar KTP/identitas sintetis tanpa data nyata.",
      "bytes": 3170,
      "sha256": "5b022bc5ff703b3d46be8f2372f5305a931b755eeed32a8496b137d628a547cc"
    },
    {
      "id": "office-document",
      "name": "Dokumen Office Dummy (DOCX)",
      "file": "office-document.docx",
      "mime_type": "application/vnd.openxmlformats-officedocument.wordprocessingml.document",
      "category": "office",
      "description": "Dokumen proposal sintetis.",
      "bytes": 980,
      "sha256": "ccbfb571c76a333e7ef21b686156ce83679f91804deda0245bb27ba4d84629ff"
    },
    {
      "id": "video-sample",
      "name": "Video Pendek Dummy (MP4)",
      "file": "video-sample.mp4",
      "mime_type": "video/mp4",
      "category": "video",
      "description": "Video warna sintetis berdurasi satu detik.",
      "bytes": 1883,
      "sha256": "1fae6b55f2150fc152fb722142cae9de4badea88e899b2c05472f9c92dd59857"
    }
  ],
  "results": [
    {
      "fixture_id": "personal-data",
      "fixture_name": "Data Personal Dummy (CSV)",
      "fixture_category": "personal",
      "mime_type": "text/csv",
      "input_bytes": 8704,
      "input_sha256": "a94101af8827e742bdbbd4aea9fbea7a4548485523b55eb35c3ae74c89a46725",
      "algorithm": "AES",
      "mode": "CBC",
      "phase": "warmup",
      "warmup": true,
      "iteration": 0,
      "encrypt_ms": 5.2426,
      "decrypt_ms": 2.2551,
      "total_ms": 7.4977,
      "encryption_throughput_mib_s": 1.583333,
      "decryption_throughput_mib_s": 3.680893,
      "total_throughput_mib_s": 1.10711,
      "envelope_bytes": 11956,
      "overhead_bytes": 3252,
      "overhead_percent": 37.362132,
      "round_trip_success": true,
      "sha256_match": true,
      "failure_reason": null,
      "runtime_version": "v24.21.0",
      "os_platform": "win32",
      "os_arch": "x64",
      "cpu_model": "AMD Ryzen 3 3250U with Radeon Graphics         ",
      "timestamp": "2026-10-26T11:18:21.419Z"
    },
    {
      "fixture_id": "personal-data",
      "fixture_name": "Data Personal Dummy (CSV)",
      "fixture_category": "personal",
      "mime_type": "text/csv",
      "input_bytes": 8704,
      "input_sha256": "a94101af8827e742bdbbd4aea9fbea7a4548485523b55eb35c3ae74c89a46725",
      "algorithm": "DES",
      "mode": "CBC",
      "phase": "warmup",
      "warmup": true,
      "iteration": 0,
      "encrypt_ms": 17.2769,
      "decrypt_ms": 12.7888,
      "total_ms": 30.0657,
      "encryption_throughput_mib_s": 0.480455,
      "decryption_throughput_mib_s": 0.649066,
      "total_throughput_mib_s": 0.276088,
      "envelope_bytes": 11932,
      "overhead_bytes": 3228,
      "overhead_percent": 37.086397,
      "round_trip_success": true,
      "sha256_match": true,
      "failure_reason": null,
      "runtime_version": "v24.21.0",
      "os_platform": "win32",
      "os_arch": "x64",
      "cpu_model": "AMD Ryzen 3 3250U with Radeon Graphics         ",
      "timestamp": "2026-10-26T11:18:21.450Z"
    },
    {
      "fixture_id": "personal-data",
      "fixture_name": "Data Personal Dummy (CSV)",
      "fixture_category": "personal",
      "mime_type": "text/csv",
      "input_bytes": 8704,
      "input_sha256": "a94101af8827e742bdbbd4aea9fbea7a4548485523b55eb35c3ae74c89a46725",
      "algorithm": "RC4",
      "mode": "STREAM",
      "phase": "warmup",
      "warmup": true,
      "iteration": 0,
      "encrypt_ms": 2.9007,
      "decrypt_ms": 1.7461,
      "total_ms": 4.6468,
      "encryption_throughput_mib_s": 2.861648,
      "decryption_throughput_mib_s": 4.753898,
      "total_throughput_mib_s": 1.786344,
      "envelope_bytes": 11917,
      "overhead_bytes": 3213,
      "overhead_percent": 36.914063,
      "round_trip_success": true,
      "sha256_match": true,
      "failure_reason": null,
      "runtime_version": "v24.21.0",
      "os_platform": "win32",
      "os_arch": "x64",
      "cpu_model": "AMD Ryzen 3 3250U with Radeon Graphics         ",
      "timestamp": "2026-10-26T11:18:21.455Z"
    },
    {
      "fixture_id": "personal-data",
      "fixture_name": "Data Personal Dummy (CSV)",
      "fixture_category": "personal",
      "mime_type": "text/csv",
      "input_bytes": 8704,
      "input_sha256": "a94101af8827e742bdbbd4aea9fbea7a4548485523b55eb35c3ae74c89a46725",
      "algorithm": "DES",
      "mode": "CBC",
      "phase": "measured",
      "warmup": false,
      "iteration": 1,
      "encrypt_ms": 6.1618,
      "decrypt_ms": 7.8181,
      "total_ms": 13.9799,
      "encryption_throughput_mib_s": 1.347136,
      "decryption_throughput_mib_s": 1.061739,
      "total_throughput_mib_s": 0.593765,
      "envelope_bytes": 11932,
      "overhead_bytes": 3228,
      "overhead_percent": 37.086397,
      "round_trip_success": true,
      "sha256_match": true,
      "failure_reason": null,
      "runtime_version": "v24.21.0",
      "os_platform": "win32",
      "os_arch": "x64",
      "cpu_model": "AMD Ryzen 3 3250U with Radeon Graphics         ",
      "timestamp": "2026-10-26T11:18:21.469Z"
    },
    {
      "fixture_id": "personal-data",
      "fixture_name": "Data Personal Dummy (CSV)",
      "fixture_category": "personal",
      "mime_type": "text/csv",
      "input_bytes": 8704,
      "input_sha256": "a94101af8827e742bdbbd4aea9fbea7a4548485523b55eb35c3ae74c89a46725",
      "algorithm": "RC4",
      "mode": "STREAM",
      "phase": "measured",
      "warmup": false,
      "iteration": 1,
      "encrypt_ms": 0.7296,
      "decrypt_ms": 0.8112,
      "total_ms": 1.5408,
      "encryption_throughput_mib_s": 11.377167,
      "decryption_throughput_mib_s": 10.232719,
      "total_throughput_mib_s": 5.387319,
      "envelope_bytes": 11917,
      "overhead_bytes": 3213,
      "overhead_percent": 36.914063,
      "round_trip_success": true,
      "sha256_match": true,
      "failure_reason": null,
      "runtime_version": "v24.21.0",
      "os_platform": "win32",
      "os_arch": "x64",
      "cpu_model": "AMD Ryzen 3 3250U with Radeon Graphics         ",
      "timestamp": "2026-10-26T11:18:21.471Z"
    },
    {
      "fixture_id": "personal-data",
      "fixture_name": "Data Personal Dummy (CSV)",
      "fixture_category": "personal",
      "mime_type": "text/csv",
      "input_bytes": 8704,
      "input_sha256": "a94101af8827e742bdbbd4aea9fbea7a4548485523b55eb35c3ae74c89a46725",
      "algorithm": "AES",
      "mode": "CBC",
      "phase": "measured",
      "warmup": false,
      "iteration": 1,
      "encrypt_ms": 1.0064,
      "decrypt_ms": 0.8882,
      "total_ms": 1.8946,
      "encryption_throughput_mib_s": 8.247994,
      "decryption_throughput_mib_s": 9.345622,
      "total_throughput_mib_s": 4.381284,
      "envelope_bytes": 11956,
      "overhead_bytes": 3252,
      "overhead_percent": 37.362132,
      "round_trip_success": true,
      "sha256_match": true,
      "failure_reason": null,
      "runtime_version": "v24.21.0",
      "os_platform": "win32",
      "os_arch": "x64",
      "cpu_model": "AMD Ryzen 3 3250U with Radeon Graphics         ",
      "timestamp": "2026-10-26T11:18:21.473Z"
    },
    {
      "fixture_id": "personal-data",
      "fixture_name": "Data Personal Dummy (CSV)",
      "fixture_category": "personal",
      "mime_type": "text/csv",
      "input_bytes": 8704,
      "input_sha256": "a94101af8827e742bdbbd4aea9fbea7a4548485523b55eb35c3ae74c89a46725",
      "algorithm": "RC4",
      "mode": "STREAM",
      "phase": "measured",
      "warmup": false,
      "iteration": 2,
      "encrypt_ms": 1.9412,
      "decrypt_ms": 0.9159,
      "total_ms": 2.8571,
      "encryption_throughput_mib_s": 4.276108,
      "decryption_throughput_mib_s": 9.062978,
      "total_throughput_mib_s": 2.905317,
      "envelope_bytes": 11917,
      "overhead_bytes": 3213,
      "overhead_percent": 36.914063,
      "round_trip_success": true,
      "sha256_match": true,
      "failure_reason": null,
      "runtime_version": "v24.21.0",
      "os_platform": "win32",
      "os_arch": "x64",
      "cpu_model": "AMD Ryzen 3 3250U with Radeon Graphics         ",
      "timestamp": "2026-10-26T11:18:21.476Z"
    },
    {
      "fixture_id": "personal-data",
      "fixture_name": "Data Personal Dummy (CSV)",
      "fixture_category": "personal",
      "mime_type": "text/csv",
      "input_bytes": 8704,